folder,frame,caption
L01_V003,199.jpg,a sence in a blue shirt and a woman in a black coat. there are two people standing in a crowded city street
L01_V003,200.jpg,a sence in a city with a lot of traffic and a lot of lights. there are many cars and trucks on the street at night
L01_V003,201.jpg,a sence in a city at night with a lot of traffic. there are many cars and motorcycles on the street at night
L01_V003,202.jpg,a sence in a city with a sign that says city street. there are a lot of icicles hanging from the street sign
L01_V003,203.jpg,"a sence in the city of tokyo, japan, is a popular place for tourists. there are many people walking on the street in the city"
L01_V003,204.jpg,a sence inflatable green monster in a crowded city street. there are people walking down the street with a giant green monster
L01_V003,205.jpg,a sence in a white shirt and tie holding a red heart. there are a lot of people in this picture that are watching tv
L01_V003,206.jpg,a sence in a white shirt and tie holding a red book. there are a lot of people in this picture that are watching the news
L01_V003,207.jpg,a sence in a car is seen in a blurry image. there are a lot of cars that are parked in the street
L01_V003,208.jpg,"a sence in china, a car is parked in a parking lot. there are many cars parked in a parking lot with a dog in the back"
L01_V003,209.jpg,a sence in a suit is getting out of a car. there are many cars parked in the parking lot behind the man
L01_V003,210.jpg,a sence in a suit walking down a street next to a car. there are a lot of people walking around in the street
L01_V003,211.jpg,a sence in a suit is talking to a woman in a suit. there are two people standing next to each other in front of a fence
L01_V003,212.jpg,a sence in a crowd of people taking pictures of a man. there are many people standing around a man taking pictures
L01_V003,213.jpg,a sence in a black and white sweater sitting on a pink chair. there are a lot of people that are sitting on the floor
L01_V003,214.jpg,a sence in a black shirt and black pants is holding a camera. there are people walking through a lobby with cameras on their laps
L01_V003,215.jpg,a sence in a white dress holding a red book. there are two women standing in front of a tv screen
L01_V003,216.jpg,a sence in a white dress holding a red book. there are a lot of news on this day that is going to be good
L01_V003,217.jpg,a sence in a white dress holding a red book. there are a lot of news on this day that is going to be broadcast
L01_V003,218.jpg,"a sence in china, china, china, and china are on the brink of the nuclear. there are smoke coming out of a factory in the distance"
L01_V003,219.jpg,"a sence in china, a chinese flag is flying high above a city. there are many people on the top of a building with a red star"
L01_V003,220.jpg,"a sence in front of a building with a sign that says,. there are people standing outside of a building with a sign on it"
L01_V003,221.jpg,a sence in a city with a pink building and a smokestack. there are cars parked in front of a pink building with a smokestack
L01_V003,222.jpg,a sence in a train station with a large group of people. there are many people sitting in a large room together
L01_V003,223.jpg,a sence in a suit and tie speaking into a microphone. there are a lot of people in this picture that are talking
L01_V003,224.jpg,a sence in a crowd of people sitting in a stadium. there are many people sitting in a crowd watching something
L01_V003,225.jpg,a sence in a suit and tie speaking into a microphone. there are a lot of people in this picture that are talking
L01_V003,226.jpg,a sence in a crowd of people sitting and standing in a room. there are many people sitting in a room together and one is talking on a cell phone
L01_V003,227.jpg,a sence in a news studio with a camera and a video camera. there are many cameras that are being used to record a news event
L01_V003,228.jpg,a sence in a brick tower with a clock on it. there are two clocks on the side of a brick building
L01_V003,229.jpg,a sence in a white shirt and tie holding a red ball. there are a lot of people in this picture that are watching the news
L01_V003,230.jpg,a sence in a white shirt and tie is standing in front of a cityscape. there are a lot of people in this picture that are watching the news
L01_V003,231.jpg,a sence in a white shirt and tie standing in front of a city. there are a lot of people in this picture that are watching tv
L01_V003,232.jpg,a sence in a blue jacket is holding a bag of food. there are two people that are standing in a room with gloves
L01_V003,233.jpg,a sence in a bathroom with a pink towel and a pink towel. there are a lot of things that are in the bathroom
L01_V003,234.jpg,a sence in a basket with a cat in it. there are two people that are petting a cat in a basket
L01_V003,235.jpg,a sence in a blue jacket holds a tiger cub in a cage. there are two people in a room with a tiger in their hands
L01_V003,236.jpg,a sence in a hospital room holding a tiger cub. there are two people in a room with a tiger in their hands
L01_V003,237.jpg,a sence in a mask and gloves holds a puppy in a cage. there are two women in black shirts holding a small dog
L01_V003,238.jpg,a sence in a red shirt is holding a dog in a cage. there are two people in a room with a dog in a cage
L01_V003,239.jpg,a sence in a black and white photo of a tiger. there are two tigers walking in a zoo enclosure together
L01_V003,240.jpg,a sence in a mask and gloves holds a tiger cub. there are two women in a room with a cat and a dog
L01_V003,241.jpg,a sence in a red hoodie holds a tiger cub in a garage. there are a lot of cats that are being held by a woman
L01_V003,242.jpg,a sence in a white shirt and tie is standing in front of a tv screen. there are a lot of people that are on this news set
L01_V003,243.jpg,a sence in a white shirt and tie is holding a wooden box. there are a lot of cheerleaders in this picture
L01_V003,244.jpg,a sence in a white shirt and tie holding a book and a red flag. there are a lot of people in this picture that are watching the news
L01_V003,245.jpg,a sence in uniform stands in front of a crowd of people. there are many soldiers in uniform standing in a line
L01_V003,246.jpg,a sence in a yellow and white uniform is performing a dance. there are many cheerleaders in white and yellow uniforms on a stage
L01_V003,247.jpg,a sence in a stadium with a large crowd of people. there are many people in the audience watching a sporting event
L01_V003,248.jpg,a sence in a stadium with a flag flying in the air. there are many people standing in a stadium watching a flag fly
L01_V003,249.jpg,a sence in a white dress holding a flag and a woman in a white dress. there are many people that are holding flags and walking
L01_V003,250.jpg,a sence in a white dress holding a flag and a red flag. there are many people in a parade with flags and mascots
L01_V003,251.jpg,a sence in a stadium with a large screen displaying a group of people. there are many people standing on a stage with a large screen
L01_V003,252.jpg,a sence in a stadium with a large circular display of people. there are many people skating on a large ice rink
L01_V003,253.jpg,a sence in a stadium with a large crowd of people. there are many people in the stadium watching a game
L01_V003,254.jpg,a sence in a stadium with a large screen displaying a performance. there are many people on stage with flags and flags
L01_V003,255.jpg,a sence in a stadium with a large screen showing a man on a stage. there are a lot of people watching a television show in a stadium
L01_V003,256.jpg,a sence in a stadium with a stage and a fire. there are a lot of people on stage with a fire
L01_V003,257.jpg,a sence in a box with a fire burning inside of it. there are a lot of fire in the dark with a black background
L01_V003,258.jpg,a sence in a large room with a lot of confetti. there are many people standing around a large circle on a stage
L01_V003,259.jpg,a sence in a stadium with a large crowd of people watching. there are many people standing in a large room with a stage
L01_V003,260.jpg,a sence in a news studio with a city in the background. there are a woman standing in front of a tv set
L01_V003,261.jpg,a sence in a news studio with a man and a woman. there are two people standing on a news set with a city in the background
L01_V003,262.jpg,a sence in a news studio with a man and a woman. there are two people standing on a news set with a city in the background
L01_V003,263.jpg,a sence in a news studio with a man and a woman. there are two people standing on a news set with a city in the background
L01_V003,264.jpg,a sence in front of a podium with israeli flags. there are many israeli flags behind a man at a podium
L01_V003,265.jpg,"a sence in front of israeli flags, a man in a black shirt and a man in. there are two men standing behind a podium with israeli flags"
L01_V003,266.jpg,"a sence in front of israeli flags, a man stands at a podium. there are two flags behind the man"
L01_V003,267.jpg,a sence in front of a podium with israeli flags and a picture of a priest. there are three men sitting at a table with flags behind them
L01_V003,268.jpg,a sence in a black shirt is speaking into a microphone. there are two men standing behind a podium with flags behind them
L01_V003,269.jpg,a sence in a black shirt is speaking into a microphone. there are two men standing behind a podium with israeli flags
L01_V003,270.jpg,a sence in china china china's new nuclear power plant. there are many vehicles that are driving down the road
L01_V003,271.jpg,"a sence in china, a truck is driving down a mountain road. there are trucks driving down a mountain road with a mountain in the background"
L01_V003,272.jpg,"a sence in china, a train is seen in this aerial image. there are many tanks that are on the ground in the dirt"
L01_V003,273.jpg,a sence in video of a storm in the middle of a city. there are many buildings in the background with a lot of smoke
L01_V003,274.jpg,a sence in a fire with a man standing in front of it. there are people standing in front of a fire that is burning
L01_V003,275.jpg,a sence in a dark room with a fire and a person on a motorcycle. there are two men on a motorcycle with a fire in the background
L01_V003,276.jpg,a sence in a fire department uniform is on the scene. there are a lot of people that are standing around a fire
L01_V003,277.jpg,a sence in a dark room with a fountain of water and people. there are many people watching a firework display in the dark
L01_V003,278.jpg,a sence in a news studio with a man and a woman. there are two people standing in front of a news set
L01_V003,279.jpg,a sence in a news studio with a man and a woman. there are two people sitting at a table with a tv screen behind them
L01_V003,280.jpg,a sence in a news studio with a man and a woman. there are two people standing in front of a news set
L01_V003,281.jpg,a sence in a news studio with a man and a woman. there are two people standing in front of a tv set
