folder,frame,caption
L01_V004,196.jpg,a sence in a large room with a large screen displaying information. there are many people sitting at tables in a large room
L01_V004,197.jpg,a sence in a large room with a lot of people. there are many people sitting in the chairs in the room
L01_V004,198.jpg,a sence in a large room with a big screen. there are many people sitting in the room watching a man speak
L01_V004,199.jpg,a sence in italian language on a screen displaying the results. there are many different numbers of names on the screen
L01_V004,200.jpg,a sence in a large room with a large screen displaying a number of people. there are many people sitting at tables in a large room
L01_V004,201.jpg,a sence in italian language is shown on a screen. there are many different languages and numbers on this screen
L01_V004,202.jpg,a sence in a meeting room with a man on a cell phone. there are two men sitting at a table with laptops
L01_V004,203.jpg,a sence in a large room with a big screen displaying a speech. there are many people sitting in the chairs in the room
L01_V004,204.jpg,a sence in a large room with a podium and a crowd of people. there are many people sitting in the seats of a large room
L01_V004,205.jpg,a sence in a large room with a lot of people. there are many people sitting in the middle of a room
L01_V004,206.jpg,a sence in a large room with a podium and a screen. there are many people sitting at tables in a large room
L01_V004,207.jpg,a sence in a large room with a large screen and a podium. there are many people sitting at tables in a large room
L01_V004,208.jpg,a sence in a suit and tie sitting at a table with a laptop. there are two men sitting at a table with laptops
L01_V004,209.jpg,a sence in a suit and tie sitting at a table with a clock. there are two men sitting at a table with a clock on it
L01_V004,210.jpg,a sence in a suit and tie sitting at a table with a cell phone. there are two people taking pictures of a man in a suit
L01_V004,211.jpg,a sence in a suit and tie standing in front of a podium with other men. there are many people standing behind a podium with flags behind them
L01_V004,212.jpg,a sence in a suit and tie standing at a podium with other men. there are many men standing behind a podium with their hands up
L01_V004,213.jpg,a sence in a news studio with a city in the background. there are a woman standing in front of a news set
L01_V004,214.jpg,a sence in a news studio with a man and a woman. there are two people standing on a news set with a city in the background
L01_V004,215.jpg,a sence in a news studio with a tv screen and a man and woman. there are two people standing on a news set with a city in the background
